{
  "formatVersion": 1,
  "synthetic": true,
  "kind": "consumer-harness",
  "referenceVersion": "1.0.0",
  "repositoryId": "fixture-repository",
  "referenceBase": "consumer-root",
  "selected": {
    "workflowRef": ".exphere/workflow/definition.json",
    "agentRefs": [
      ".exphere/agents/planner.json"
    ],
    "guideRefs": [
      ".exphere/guides/execution.md",
      ".exphere/guides/ownership.md"
    ],
    "sensorsRef": ".exphere/sensors/checks.json",
    "skillRefs": [
      ".exphere/skills/review-plan/SKILL.md"
    ],
    "runtimes": [
      {
        "id": "website-preview",
        "descriptorRef": ".exphere/runtimes/website-preview/schema.json"
      }
    ]
  },
  "capabilities": {
    "langgraph": "unavailable",
    "mcp": "unavailable",
    "rag": "unavailable"
  },
  "retrieval": {
    "required": true,
    "corpora": [
      {
        "id": "feature-context",
        "path": ".exphere/guides/feature.md",
        "repositoryId": "fixture-repository",
        "runtimeId": "website-preview",
        "revision": "fixture-content-v1",
        "sha256": "ab46360897c92fc922ce3c31350d4e553cbf5ce1d592a7262ada191dfb107ba8"
      }
    ],
    "maxDocuments": 4,
    "maxContextTokens": 4096,
    "exclude": [
      ".env*",
      "**/secrets/**",
      "**/kubeconfig",
      "**/*.tfstate*",
      "**/accounting/**",
      "**/state/**"
    ],
    "freshness": {
      "revisionPolicy": "exact",
      "maxAgeSeconds": 3600
    }
  },
  "models": {
    "catalogRevision": "fixture-catalog-v1",
    "priceRevision": "fixture-price-v1",
    "provenance": "synthetic",
    "currency": "USD",
    "profiles": [
      {
        "id": "economy",
        "provider": "fixture",
        "model": "small-fixture",
        "purpose": "Bounded routine edits with mandatory verification",
        "supportedEfforts": [
          "low"
        ],
        "effortMapping": {
          "low": "low"
        },
        "inputMicrosPerToken": "1",
        "outputMicrosPerToken": "2",
        "maxOutputTokens": 1000,
        "capabilitySourceRef": ".exphere/guides/model-catalog.md"
      },
      {
        "id": "deliberate",
        "provider": "fixture",
        "model": "large-fixture",
        "purpose": "More expensive analysis for uncertain changes",
        "supportedEfforts": [
          "medium",
          "high"
        ],
        "effortMapping": {
          "medium": "medium",
          "high": "high"
        },
        "inputMicrosPerToken": "3",
        "outputMicrosPerToken": "6",
        "maxOutputTokens": 1000,
        "capabilitySourceRef": ".exphere/guides/model-catalog.md"
      }
    ]
  },
  "bootstrap": {
    "profileId": "economy",
    "effort": "low",
    "allowanceMicros": "100000",
    "coveredPurposes": [
      "embedding",
      "retrieval",
      "planning",
      "review",
      "diagnosis",
      "retry",
      "explanation"
    ]
  },
  "budget": {
    "policyRevision": "fixture-policy-v1",
    "currency": "USD",
    "unit": "microcurrency",
    "scale": 6,
    "rounding": "ceil-reservation-half-up-observed",
    "owner": "fixture-owner",
    "window": {
      "start": "2000-01-01T00:00:00Z",
      "end": "2000-01-02T00:00:00Z"
    },
    "coverage": {
      "ai": "bounded",
      "infrastructure": "allocation-estimate",
      "other": "excluded"
    },
    "failureBehavior": "reject-unknown-or-unbounded",
    "accounts": [
      {
        "id": "window",
        "kind": "funding-window",
        "caps": {
          "ai": "1000000",
          "infrastructure": "500000",
          "combined": "1500000"
        },
        "protected": {
          "ai": "100000",
          "infrastructure": "50000",
          "combined": "150000"
        }
      },
      {
        "id": "feature",
        "kind": "feature",
        "caps": {
          "ai": "1000000",
          "infrastructure": "500000",
          "combined": "1500000"
        },
        "protected": {
          "ai": "100000",
          "infrastructure": "50000",
          "combined": "150000"
        },
        "parentId": "window"
      },
      {
        "id": "cycle",
        "kind": "cycle",
        "caps": {
          "ai": "1000000",
          "infrastructure": "500000",
          "combined": "1500000"
        },
        "protected": {
          "ai": "100000",
          "infrastructure": "50000",
          "combined": "150000"
        },
        "parentId": "feature"
      }
    ]
  },
  "infrastructure": {
    "valuation": "allocation-estimate",
    "horizonSeconds": 3600,
    "maxLifetimeSeconds": 7200,
    "inspectionSeconds": 60,
    "shutdownAuthority": "fixture-operator",
    "residualCosts": [
      "storage",
      "network"
    ],
    "cleanupRequired": true,
    "rateRevision": "fixture-hardware-v1",
    "hourlyAllocationMicros": "50000",
    "hardCapSupported": false
  },
  "stores": {
    "accounting": {
      "id": "shared-accounting",
      "implementation": "unavailable",
      "writer": "accounting-dispatcher",
      "path": ".exphere/artifacts/accounting"
    },
    "graph": {
      "id": "graph-state",
      "implementation": "unavailable",
      "writer": "graph-executor",
      "path": ".exphere/state/graph"
    }
  }
}
